paper_id,title,summary,published,authors,pdf_url
2407.01290v2,Hypformer: Exploring Efficient Transformer Fully in Hyperbolic Space,"Hyperbolic geometry have shown significant potential in modeling complex structured data, particularly those with underlying tree-like and hierarchical structures. Despite the impressive performance of various hyperbolic neural networks across numerous domains, research on adapting the Transformer to hyperbolic space remains limited. Previous attempts have mainly focused on modifying self-attention modules in the Transformer. However, these efforts have fallen short of developing a complete hyperbolic Transformer. This stems primarily from: (i) the absence of well-defined modules in hyperbolic space, including linear transformation layers, LayerNorm layers, activation functions, dropout operations, etc. (ii) the quadratic time complexity of the existing hyperbolic self-attention module w.r.t the number of input tokens, which hinders its scalability. To address these challenges, we propose, Hypformer, a novel hyperbolic Transformer based on the Lorentz model of hyperbolic geometry. In Hypformer, we introduce two foundational blocks that define the essential modules of the Transformer in hyperbolic space. Furthermore, we develop a linear self-attention mechanism in hyperbolic space, enabling hyperbolic Transformer to process billion-scale graph data and long-sequence inputs for the first time. Our experimental results confirm the effectiveness and efficiency of Hypformer across various datasets, demonstrating its potential as an effective and scalable solution for large-scale data representation and large models.",2024-07-01T13:44:38Z,"Menglin Yang, Harshit Verma, Delvin Ce Zhang, Jiahong Liu, Irwin King, Rex Ying",https://arxiv.org/pdf/2407.01290v2
2112.12782v3,SeMask: Semantically Masked Transformers for Semantic Segmentation,"Finetuning a pretrained backbone in the encoder part of an image transformer network has been the traditional approach for the semantic segmentation task. However, such an approach leaves out the semantic context that an image provides during the encoding stage. This paper argues that incorporating semantic information of the image into pretrained hierarchical transformer-based backbones while finetuning improves the performance considerably. To achieve this, we propose SeMask, a simple and effective framework that incorporates semantic information into the encoder with the help of a semantic attention operation. In addition, we use a lightweight semantic decoder during training to provide supervision to the intermediate semantic prior maps at every stage. Our experiments demonstrate that incorporating semantic priors enhances the performance of the established hierarchical encoders with a slight increase in the number of FLOPs. We provide empirical proof by integrating SeMask into Swin Transformer and Mix Transformer backbones as our encoder paired with different decoders. Our framework achieves a new state-of-the-art of 58.25% mIoU on the ADE20K dataset and improvements of over 3% in the mIoU metric on the Cityscapes dataset. The code and checkpoints are publicly available at https://github.com/Picsart-AI-Research/SeMask-Segmentation .",2021-12-23T18:56:02Z,"Jitesh Jain, Anukriti Singh, Nikita Orlov, Zilong Huang, Jiachen Li, Steven Walton, Humphrey Shi",https://arxiv.org/pdf/2112.12782v3
2402.06492v1,Inducing Systematicity in Transformers by Attending to Structurally Quantized Embeddings,"Transformers generalize to novel compositions of structures and entities after being trained on a complex dataset, but easily overfit on datasets of insufficient complexity. We observe that when the training set is sufficiently complex, the model encodes sentences that have a common syntactic structure using a systematic attention pattern. Inspired by this observation, we propose SQ-Transformer (Structurally Quantized) that explicitly encourages systematicity in the embeddings and attention layers, even with a training set of low complexity. At the embedding level, we introduce Structure-oriented Vector Quantization (SoVQ) to cluster word embeddings into several classes of structurally equivalent entities. At the attention level, we devise the Systematic Attention Layer (SAL) and an alternative, Systematically Regularized Layer (SRL) that operate on the quantized word embeddings so that sentences of the same structure are encoded with invariant or similar attention patterns. Empirically, we show that SQ-Transformer achieves stronger compositional generalization than the vanilla Transformer on multiple low-complexity semantic parsing and machine translation datasets. In our analysis, we show that SoVQ indeed learns a syntactically clustered embedding space and SAL/SRL induces generalizable attention patterns, which lead to improved systematicity.",2024-02-09T15:53:15Z,"Yichen Jiang, Xiang Zhou, Mohit Bansal",https://arxiv.org/pdf/2402.06492v1
2407.00261v2,Generative Iris Prior Embedded Transformer for Iris Restoration,"Iris restoration from complexly degraded iris images, aiming to improve iris recognition performance, is a challenging problem. Due to the complex degradation, directly training a convolutional neural network (CNN) without prior cannot yield satisfactory results. In this work, we propose a generative iris prior embedded Transformer model (Gformer), in which we build a hierarchical encoder-decoder network employing Transformer block and generative iris prior. First, we tame Transformer blocks to model long-range dependencies in target images. Second, we pretrain an iris generative adversarial network (GAN) to obtain the rich iris prior, and incorporate it into the iris restoration process with our iris feature modulator. Our experiments demonstrate that the proposed Gformer outperforms state-of-the-art methods. Besides, iris recognition performance has been significantly improved after applying Gformer.",2024-06-28T23:20:57Z,"Yubo Huang, Jia Wang, Peipei Li, Liuyu Xiang, Peigang Li, Zhaofeng He",https://arxiv.org/pdf/2407.00261v2
2302.14017v1,Full Stack Optimization of Transformer Inference: a Survey,"Recent advances in state-of-the-art DNN architecture design have been moving toward Transformer models. These models achieve superior accuracy across a wide range of applications. This trend has been consistent over the past several years since Transformer models were originally introduced. However, the amount of compute and bandwidth required for inference of recent Transformer models is growing at a significant rate, and this has made their deployment in latency-sensitive applications challenging. As such, there has been an increased focus on making Transformer models more efficient, with methods that range from changing the architecture design, all the way to developing dedicated domain-specific accelerators. In this work, we survey different approaches for efficient Transformer inference, including: (i) analysis and profiling of the bottlenecks in existing Transformer architectures and their similarities and differences with previous convolutional models; (ii) implications of Transformer architecture on hardware, including the impact of non-linear operations such as Layer Normalization, Softmax, and GELU, as well as linear operations, on hardware design; (iii) approaches for optimizing a fixed Transformer architecture; (iv) challenges in finding the right mapping and scheduling of operations for Transformer models; and (v) approaches for optimizing Transformer models by adapting the architecture using neural architecture search. Finally, we perform a case study by applying the surveyed optimizations on Gemmini, the open-source, full-stack DNN accelerator generator, and we show how each of these approaches can yield improvements, compared to previous benchmark results on Gemmini. Among other things, we find that a full-stack co-design approach with the aforementioned methods can result in up to 88.7x speedup with a minimal performance degradation for Transformer inference.",2023-02-27T18:18:13Z,"Sehoon Kim, Coleman Hooper, Thanakul Wattanawong, Minwoo Kang, Ruohan Yan, Hasan Genc, Grace Dinh, Qijing Huang, Kurt Keutzer, Michael W. Mahoney, Yakun Sophia Shao, Amir Gholami",https://arxiv.org/pdf/2302.14017v1
2305.19533v3,Lightening-Transformer: A Dynamically-operated Optically-interconnected Photonic Transformer Accelerator,"The wide adoption and significant computing resource of attention-based transformers, e.g., Vision Transformers and large language models (LLM), have driven the demand for efficient hardware accelerators. There is a growing interest in exploring photonics as an alternative technology to digital electronics due to its high energy efficiency and ultra-fast processing speed. Photonic accelerators have shown promising results for CNNs, which mainly rely on weight-static linear operations. However, they encounter issues when efficiently supporting Transformer architectures, questioning the applicability of photonics to advanced ML tasks. The primary hurdle lies in their inefficiency in handling unique workloads in Transformers, i.e., dynamic and full-range tensor multiplication. In this work, we propose Lightening-Transformer, the first light-empowered, high-performance, and energy-efficient photonic Transformer accelerator. To overcome prior designs' fundamental limitations, we introduce a novel dynamically-operated photonic tensor core, DPTC, a crossbar array of interference-based optical vector dot-product engines supporting highly parallel, dynamic, and full-range matrix multiplication. Furthermore, we design a dedicated accelerator that integrates our novel photonic computing cores with photonic interconnects for inter-core data broadcast, fully unleashing the power of optics. Comprehensive evaluations show that ours achieves >2.6x energy and >12x latency reductions compared to prior photonic accelerators and delivers the lowest energy cost and 2 to 3 orders of magnitude lower energy-delay product compared to electronic Transformer accelerators, all while maintaining digital-comparable accuracy. Our work highlights the immense potential of photonics for advanced ML workloads, such as Transformer-backboned LLM. Our work is available at https://github.com/zhuhanqing/Lightening-Transformer.",2023-05-31T03:37:11Z,"Hanqing Zhu, Jiaqi Gu, Hanrui Wang, Zixuan Jiang, Zhekai Zhang, Rongxing Tang, Chenghao Feng, Song Han, Ray T. Chen, David Z. Pan",https://arxiv.org/pdf/2305.19533v3
2504.14092v1,Retinex-guided Histogram Transformer for Mask-free Shadow Removal,"While deep learning methods have achieved notable progress in shadow removal, many existing approaches rely on shadow masks that are difficult to obtain, limiting their generalization to real-world scenes. In this work, we propose ReHiT, an efficient mask-free shadow removal framework based on a hybrid CNN-Transformer architecture guided by Retinex theory. We first introduce a dual-branch pipeline to separately model reflectance and illumination components, and each is restored by our developed Illumination-Guided Hybrid CNN-Transformer (IG-HCT) module. Second, besides the CNN-based blocks that are capable of learning residual dense features and performing multi-scale semantic fusion, multi-scale semantic fusion, we develop the Illumination-Guided Histogram Transformer Block (IGHB) to effectively handle non-uniform illumination and spatially complex shadows. Extensive experiments on several benchmark datasets validate the effectiveness of our approach over existing mask-free methods. Trained solely on the NTIRE 2025 Shadow Removal Challenge dataset, our solution delivers competitive results with one of the smallest parameter sizes and fastest inference speeds among top-ranked entries, highlighting its applicability for real-world applications with limited computational resources. The code is available at https://github.com/dongw22/oath.",2025-04-18T22:19:40Z,"Wei Dong, Han Zhou, Seyed Amirreza Mousavi, Jun Chen",https://arxiv.org/pdf/2504.14092v1
2407.10949v2,Representing Rule-based Chatbots with Transformers,"What kind of internal mechanisms might Transformers use to conduct fluid, natural-sounding conversations? Prior work has illustrated by construction how Transformers can solve various synthetic tasks, such as sorting a list or recognizing formal languages, but it remains unclear how to extend this approach to a conversational setting. In this work, we propose using ELIZA, a classic rule-based chatbot, as a setting for formal, mechanistic analysis of Transformer-based chatbots. ELIZA allows us to formally model key aspects of conversation, including local pattern matching and long-term dialogue state tracking. We first present a theoretical construction of a Transformer that implements the ELIZA chatbot. Building on prior constructions, particularly those for simulating finite-state automata, we show how simpler mechanisms can be composed and extended to produce more sophisticated behavior. Next, we conduct a set of empirical analyses of Transformers trained on synthetically generated ELIZA conversations. Our analysis illustrates the kinds of mechanisms these models tend to prefer--for example, models favor an induction head mechanism over a more precise, position-based copying mechanism; and using intermediate generations to simulate recurrent data structures, akin to an implicit scratchpad or Chain-of-Thought. Overall, by drawing an explicit connection between neural chatbots and interpretable, symbolic mechanisms, our results provide a new framework for the mechanistic analysis of conversational agents.",2024-07-15T17:45:53Z,"Dan Friedman, Abhishek Panigrahi, Danqi Chen",https://arxiv.org/pdf/2407.10949v2
1803.01837v1,ST-GAN: Spatial Transformer Generative Adversarial Networks for Image Compositing,"We address the problem of finding realistic geometric corrections to a foreground object such that it appears natural when composited into a background image. To achieve this, we propose a novel Generative Adversarial Network (GAN) architecture that utilizes Spatial Transformer Networks (STNs) as the generator, which we call Spatial Transformer GANs (ST-GANs). ST-GANs seek image realism by operating in the geometric warp parameter space. In particular, we exploit an iterative STN warping scheme and propose a sequential training strategy that achieves better results compared to naive training of a single generator. One of the key advantages of ST-GAN is its applicability to high-resolution images indirectly since the predicted warp parameters are transferable between reference frames. We demonstrate our approach in two applications: (1) visualizing how indoor furniture (e.g. from product images) might be perceived in a room, (2) hallucinating how accessories like glasses would look when matched with real portraits.",2018-03-05T18:59:01Z,"Chen-Hsuan Lin, Ersin Yumer, Oliver Wang, Eli Shechtman, Simon Lucey",https://arxiv.org/pdf/1803.01837v1
2201.01893v3,Flow-Guided Sparse Transformer for Video Deblurring,"Exploiting similar and sharper scene patches in spatio-temporal neighborhoods is critical for video deblurring. However, CNN-based methods show limitations in capturing long-range dependencies and modeling non-local self-similarity. In this paper, we propose a novel framework, Flow-Guided Sparse Transformer (FGST), for video deblurring. In FGST, we customize a self-attention module, Flow-Guided Sparse Window-based Multi-head Self-Attention (FGSW-MSA). For each $query$ element on the blurry reference frame, FGSW-MSA enjoys the guidance of the estimated optical flow to globally sample spatially sparse yet highly related $key$ elements corresponding to the same scene patch in neighboring frames. Besides, we present a Recurrent Embedding (RE) mechanism to transfer information from past frames and strengthen long-range temporal dependencies. Comprehensive experiments demonstrate that our proposed FGST outperforms state-of-the-art (SOTA) methods on both DVD and GOPRO datasets and even yields more visually pleasing results in real video deblurring. Code and pre-trained models are publicly available at https://github.com/linjing7/VR-Baseline",2022-01-06T02:05:32Z,"Jing Lin, Yuanhao Cai, Xiaowan Hu, Haoqian Wang, Youliang Yan, Xueyi Zou, Henghui Ding, Yulun Zhang, Radu Timofte, Luc Van Gool",https://arxiv.org/pdf/2201.01893v3
2205.10102v3,Degradation-Aware Unfolding Half-Shuffle Transformer for Spectral Compressive Imaging,"In coded aperture snapshot spectral compressive imaging (CASSI) systems, hyperspectral image (HSI) reconstruction methods are employed to recover the spatial-spectral signal from a compressed measurement. Among these algorithms, deep unfolding methods demonstrate promising performance but suffer from two issues. Firstly, they do not estimate the degradation patterns and ill-posedness degree from the highly related CASSI to guide the iterative learning. Secondly, they are mainly CNN-based, showing limitations in capturing long-range dependencies. In this paper, we propose a principled Degradation-Aware Unfolding Framework (DAUF) that estimates parameters from the compressed image and physical mask, and then uses these parameters to control each iteration. Moreover, we customize a novel Half-Shuffle Transformer (HST) that simultaneously captures local contents and non-local dependencies. By plugging HST into DAUF, we establish the first Transformer-based deep unfolding method, Degradation-Aware Unfolding Half-Shuffle Transformer (DAUHST), for HSI reconstruction. Experiments show that DAUHST significantly surpasses state-of-the-art methods while requiring cheaper computational and memory costs. Code and models will be released at https://github.com/caiyuanhao1998/MST",2022-05-20T11:37:44Z,"Yuanhao Cai, Jing Lin, Haoqian Wang, Xin Yuan, Henghui Ding, Yulun Zhang, Radu Timofte, Luc Van Gool",https://arxiv.org/pdf/2205.10102v3
2305.18415v3,Geometric Algebra Transformer,"Problems involving geometric data arise in physics, chemistry, robotics, computer vision, and many other fields. Such data can take numerous forms, for instance points, direction vectors, translations, or rotations, but to date there is no single architecture that can be applied to such a wide variety of geometric types while respecting their symmetries. In this paper we introduce the Geometric Algebra Transformer (GATr), a general-purpose architecture for geometric data. GATr represents inputs, outputs, and hidden states in the projective geometric (or Clifford) algebra, which offers an efficient 16-dimensional vector-space representation of common geometric objects as well as operators acting on them. GATr is equivariant with respect to E(3), the symmetry group of 3D Euclidean space. As a Transformer, GATr is versatile, efficient, and scalable. We demonstrate GATr in problems from n-body modeling to wall-shear-stress estimation on large arterial meshes to robotic motion planning. GATr consistently outperforms both non-geometric and equivariant baselines in terms of error, data efficiency, and scalability.",2023-05-28T18:48:50Z,"Johann Brehmer, Pim de Haan, Sönke Behrends, Taco Cohen",https://arxiv.org/pdf/2305.18415v3
2301.09869v2,Image Super-Resolution using Efficient Striped Window Transformer,"Transformers have achieved remarkable results in single-image super-resolution (SR). However, the challenge of balancing model performance and complexity has hindered their application in lightweight SR (LSR). To tackle this challenge, we propose an efficient striped window transformer (ESWT). We revisit the normalization layer in the transformer and design a concise and efficient transformer structure to build the ESWT. Furthermore, we introduce a striped window mechanism to model long-term dependencies more efficiently. To fully exploit the potential of the ESWT, we propose a novel flexible window training strategy that can improve the performance of the ESWT without additional cost. Extensive experiments show that ESWT outperforms state-of-the-art LSR transformers, and achieves a better trade-off between model performance and complexity. The ESWT requires fewer parameters, incurs faster inference, smaller FLOPs, and less memory consumption, making it a promising solution for LSR.",2023-01-24T09:09:35Z,"Jinpeng Shi, Hui Li, Tianle Liu, Yulong Liu, Mingjian Zhang, Jinchen Zhu, Ling Zheng, Shizhuang Weng",https://arxiv.org/pdf/2301.09869v2
2209.15001v3,Dilated Neighborhood Attention Transformer,"Transformers are quickly becoming one of the most heavily applied deep learning architectures across modalities, domains, and tasks. In vision, on top of ongoing efforts into plain transformers, hierarchical transformers have also gained significant attention, thanks to their performance and easy integration into existing frameworks. These models typically employ localized attention mechanisms, such as the sliding-window Neighborhood Attention (NA) or Swin Transformer's Shifted Window Self Attention. While effective at reducing self attention's quadratic complexity, local attention weakens two of the most desirable properties of self attention: long range inter-dependency modeling, and global receptive field. In this paper, we introduce Dilated Neighborhood Attention (DiNA), a natural, flexible and efficient extension to NA that can capture more global context and expand receptive fields exponentially at no additional cost. NA's local attention and DiNA's sparse global attention complement each other, and therefore we introduce Dilated Neighborhood Attention Transformer (DiNAT), a new hierarchical vision transformer built upon both. DiNAT variants enjoy significant improvements over strong baselines such as NAT, Swin, and ConvNeXt. Our large model is faster and ahead of its Swin counterpart by 1.6% box AP in COCO object detection, 1.4% mask AP in COCO instance segmentation, and 1.4% mIoU in ADE20K semantic segmentation. Paired with new frameworks, our large variant is the new state of the art panoptic segmentation model on COCO (58.5 PQ) and ADE20K (49.4 PQ), and instance segmentation model on Cityscapes (45.1 AP) and ADE20K (35.4 AP) (no extra data). It also matches the state of the art specialized semantic segmentation models on ADE20K (58.1 mIoU), and ranks second on Cityscapes (84.5 mIoU) (no extra data).",2022-09-29T17:57:08Z,"Ali Hassani, Humphrey Shi",https://arxiv.org/pdf/2209.15001v3
2504.14075v1,Towards Scale-Aware Low-Light Enhancement via Structure-Guided Transformer Design,"Current Low-light Image Enhancement (LLIE) techniques predominantly rely on either direct Low-Light (LL) to Normal-Light (NL) mappings or guidance from semantic features or illumination maps. Nonetheless, the intrinsic ill-posedness of LLIE and the difficulty in retrieving robust semantics from heavily corrupted images hinder their effectiveness in extremely low-light environments. To tackle this challenge, we present SG-LLIE, a new multi-scale CNN-Transformer hybrid framework guided by structure priors. Different from employing pre-trained models for the extraction of semantics or illumination maps, we choose to extract robust structure priors based on illumination-invariant edge detectors. Moreover, we develop a CNN-Transformer Hybrid Structure-Guided Feature Extractor (HSGFE) module at each scale with in the UNet encoder-decoder architecture. Besides the CNN blocks which excels in multi-scale feature extraction and fusion, we introduce a Structure-Guided Transformer Block (SGTB) in each HSGFE that incorporates structural priors to modulate the enhancement process. Extensive experiments show that our method achieves state-of-the-art performance on several LLIE benchmarks in both quantitative metrics and visual quality. Our solution ranks second in the NTIRE 2025 Low-Light Enhancement Challenge. Code is released at https://github.com/minyan8/imagine.",2025-04-18T20:57:16Z,"Wei Dong, Yan Min, Han Zhou, Jun Chen",https://arxiv.org/pdf/2504.14075v1
2203.14508v1,Stratified Transformer for 3D Point Cloud Segmentation,"3D point cloud segmentation has made tremendous progress in recent years. Most current methods focus on aggregating local features, but fail to directly model long-range dependencies. In this paper, we propose Stratified Transformer that is able to capture long-range contexts and demonstrates strong generalization ability and high performance. Specifically, we first put forward a novel key sampling strategy. For each query point, we sample nearby points densely and distant points sparsely as its keys in a stratified way, which enables the model to enlarge the effective receptive field and enjoy long-range contexts at a low computational cost. Also, to combat the challenges posed by irregular point arrangements, we propose first-layer point embedding to aggregate local information, which facilitates convergence and boosts performance. Besides, we adopt contextual relative position encoding to adaptively capture position information. Finally, a memory-efficient implementation is introduced to overcome the issue of varying point numbers in each window. Extensive experiments demonstrate the effectiveness and superiority of our method on S3DIS, ScanNetv2 and ShapeNetPart datasets. Code is available at https://github.com/dvlab-research/Stratified-Transformer.",2022-03-28T05:35:16Z,"Xin Lai, Jianhui Liu, Li Jiang, Liwei Wang, Hengshuang Zhao, Shu Liu, Xiaojuan Qi, Jiaya Jia",https://arxiv.org/pdf/2203.14508v1
