paper_id,title,summary,published,authors,pdf_url
2601.12039v1,Nonlinear Dynamic Factor Analysis With a Transformer Network,"The paper develops a Transformer architecture for estimating dynamic factors from multivariate time series data under flexible identification assumptions. Performance on small datasets is improved substantially by using a conventional factor model as prior information via a regularization term in the training objective. The results are interpreted with Attention matrices that quantify the relative importance of variables and their lags for the factor estimate. Time variation in Attention patterns can help detect regime switches and evaluate narratives. Monte Carlo experiments suggest that the Transformer is more accurate than the linear factor model, when the data deviate from linear-Gaussian assumptions. An empirical application uses the Transformer to construct a coincident index of U.S. real economic activity.",2026-01-17T12:59:58Z,Oliver Snellman,https://arxiv.org/pdf/2601.12039v1
2207.13861v2,DnSwin: Toward Real-World Denoising via Continuous Wavelet Sliding-Transformer,"Real-world image denoising is a practical image restoration problem that aims to obtain clean images from in-the-wild noisy inputs. Recently, the Vision Transformer (ViT) has exhibited a strong ability to capture long-range dependencies, and many researchers have attempted to apply the ViT to image denoising tasks. However, a real-world image is an isolated frame that makes the ViT build long-range dependencies based on the internal patches, which divides images into patches, disarranges noise patterns and damages gradient continuity. In this article, we propose to resolve this issue by using a continuous Wavelet Sliding-Transformer that builds frequency correspondences under real-world scenes, called DnSwin. Specifically, we first extract the bottom features from noisy input images by using a convolutional neural network (CNN) encoder. The key to DnSwin is to extract high-frequency and low-frequency information from the observed features and build frequency dependencies. To this end, we propose a Wavelet Sliding-Window Transformer (WSWT) that utilizes the discrete wavelet transform (DWT), self-attention and the inverse DWT (IDWT) to extract deep features. Finally, we reconstruct the deep features into denoised images using a CNN decoder. Both quantitative and qualitative evaluations conducted on real-world denoising benchmarks demonstrate that the proposed DnSwin performs favorably against the state-of-the-art methods.",2022-07-28T02:33:57Z,"Hao Li, Zhijing Yang, Xiaobin Hong, Ziying Zhao, Junyang Chen, Yukai Shi, Jinshan Pan",https://arxiv.org/pdf/2207.13861v2
2410.01912v1,A Spark of Vision-Language Intelligence: 2-Dimensional Autoregressive Transformer for Efficient Finegrained Image Generation,"This work tackles the information loss bottleneck of vector-quantization (VQ) autoregressive image generation by introducing a novel model architecture called the 2-Dimensional Autoregression (DnD) Transformer. The DnD-Transformer predicts more codes for an image by introducing a new autoregression direction, \textit{model depth}, along with the sequence length direction. Compared to traditional 1D autoregression and previous work utilizing similar 2D image decomposition such as RQ-Transformer, the DnD-Transformer is an end-to-end model that can generate higher quality images with the same backbone model size and sequence length, opening a new optimization perspective for autoregressive image generation. Furthermore, our experiments reveal that the DnD-Transformer's potential extends beyond generating natural images. It can even generate images with rich text and graphical elements in a self-supervised manner, demonstrating an understanding of these combined modalities. This has not been previously demonstrated for popular vision generative models such as diffusion models, showing a spark of vision-language intelligence when trained solely on images. Code, datasets and models are open at https://github.com/chenllliang/DnD-Transformer.",2024-10-02T18:10:05Z,"Liang Chen, Sinan Tan, Zefan Cai, Weichu Xie, Haozhe Zhao, Yichi Zhang, Junyang Lin, Jinze Bai, Tianyu Liu, Baobao Chang",https://arxiv.org/pdf/2410.01912v1
2210.01765v4,One Transformer Can Understand Both 2D & 3D Molecular Data,"Unlike vision and language data which usually has a unique format, molecules can naturally be characterized using different chemical formulations. One can view a molecule as a 2D graph or define it as a collection of atoms located in a 3D space. For molecular representation learning, most previous works designed neural networks only for a particular data format, making the learned models likely to fail for other data formats. We believe a general-purpose neural network model for chemistry should be able to handle molecular tasks across data modalities. To achieve this goal, in this work, we develop a novel Transformer-based Molecular model called Transformer-M, which can take molecular data of 2D or 3D formats as input and generate meaningful semantic representations. Using the standard Transformer as the backbone architecture, Transformer-M develops two separated channels to encode 2D and 3D structural information and incorporate them with the atom features in the network modules. When the input data is in a particular format, the corresponding channel will be activated, and the other will be disabled. By training on 2D and 3D molecular data with properly designed supervised signals, Transformer-M automatically learns to leverage knowledge from different data modalities and correctly capture the representations. We conducted extensive experiments for Transformer-M. All empirical results show that Transformer-M can simultaneously achieve strong performance on 2D and 3D tasks, suggesting its broad applicability. The code and models will be made publicly available at https://github.com/lsj2408/Transformer-M.",2022-10-04T17:30:31Z,"Shengjie Luo, Tianlang Chen, Yixian Xu, Shuxin Zheng, Tie-Yan Liu, Liwei Wang, Di He",https://arxiv.org/pdf/2210.01765v4
2004.13542v4,Faster Depth-Adaptive Transformers,"Depth-adaptive neural networks can dynamically adjust depths according to the hardness of input words, and thus improve efficiency. The main challenge is how to measure such hardness and decide the required depths (i.e., layers) to conduct. Previous works generally build a halting unit to decide whether the computation should continue or stop at each layer. As there is no specific supervision of depth selection, the halting unit may be under-optimized and inaccurate, which results in suboptimal and unstable performance when modeling sentences. In this paper, we get rid of the halting unit and estimate the required depths in advance, which yields a faster depth-adaptive model. Specifically, two approaches are proposed to explicitly measure the hardness of input words and estimate corresponding adaptive depth, namely 1) mutual information (MI) based estimation and 2) reconstruction loss based estimation. We conduct experiments on the text classification task with 24 datasets in various sizes and domains. Results confirm that our approaches can speed up the vanilla Transformer (up to 7x) while preserving high accuracy. Moreover, efficiency and robustness are significantly improved when compared with other depth-adaptive approaches.",2020-04-27T15:08:10Z,"Yijin Liu, Fandong Meng, Jie Zhou, Yufeng Chen, Jinan Xu",https://arxiv.org/pdf/2004.13542v4
2403.06536v1,Multi-Scale Implicit Transformer with Re-parameterize for Arbitrary-Scale Super-Resolution,"Recently, the methods based on implicit neural representations have shown excellent capabilities for arbitrary-scale super-resolution (ASSR). Although these methods represent the features of an image by generating latent codes, these latent codes are difficult to adapt for different magnification factors of super-resolution, which seriously affects their performance. Addressing this, we design Multi-Scale Implicit Transformer (MSIT), consisting of an Multi-scale Neural Operator (MSNO) and Multi-Scale Self-Attention (MSSA). Among them, MSNO obtains multi-scale latent codes through feature enhancement, multi-scale characteristics extraction, and multi-scale characteristics merging. MSSA further enhances the multi-scale characteristics of latent codes, resulting in better performance. Furthermore, to improve the performance of network, we propose the Re-Interaction Module (RIM) combined with the cumulative training strategy to improve the diversity of learned information for the network. We have systematically introduced multi-scale characteristics for the first time in ASSR, extensive experiments are performed to validate the effectiveness of MSIT, and our method achieves state-of-the-art performance in arbitrary super-resolution tasks.",2024-03-11T09:23:20Z,"Jinchen Zhu, Mingjian Zhang, Ling Zheng, Shizhuang Weng",https://arxiv.org/pdf/2403.06536v1
2304.03635v1,A2J-Transformer: Anchor-to-Joint Transformer Network for 3D Interacting Hand Pose Estimation from a Single RGB Image,"3D interacting hand pose estimation from a single RGB image is a challenging task, due to serious self-occlusion and inter-occlusion towards hands, confusing similar appearance patterns between 2 hands, ill-posed joint position mapping from 2D to 3D, etc.. To address these, we propose to extend A2J-the state-of-the-art depth-based 3D single hand pose estimation method-to RGB domain under interacting hand condition. Our key idea is to equip A2J with strong local-global aware ability to well capture interacting hands' local fine details and global articulated clues among joints jointly. To this end, A2J is evolved under Transformer's non-local encoding-decoding framework to build A2J-Transformer. It holds 3 main advantages over A2J. First, self-attention across local anchor points is built to make them global spatial context aware to better capture joints' articulation clues for resisting occlusion. Secondly, each anchor point is regarded as learnable query with adaptive feature learning for facilitating pattern fitting capacity, instead of having the same local representation with the others. Last but not least, anchor point locates in 3D space instead of 2D as in A2J, to leverage 3D pose prediction. Experiments on challenging InterHand 2.6M demonstrate that, A2J-Transformer can achieve state-of-the-art model-free performance (3.38mm MPJPE advancement in 2-hand case) and can also be applied to depth domain with strong generalization.",2023-04-07T13:30:36Z,"Changlong Jiang, Yang Xiao, Cunlin Wu, Mingyang Zhang, Jinghong Zheng, Zhiguo Cao, Joey Tianyi Zhou",https://arxiv.org/pdf/2304.03635v1
2109.05566v2,PQ-Transformer: Jointly Parsing 3D Objects and Layouts from Point Clouds,"3D scene understanding from point clouds plays a vital role for various robotic applications. Unfortunately, current state-of-the-art methods use separate neural networks for different tasks like object detection or room layout estimation. Such a scheme has two limitations: 1) Storing and running several networks for different tasks are expensive for typical robotic platforms. 2) The intrinsic structure of separate outputs are ignored and potentially violated. To this end, we propose the first transformer architecture that predicts 3D objects and layouts simultaneously, using point cloud inputs. Unlike existing methods that either estimate layout keypoints or edges, we directly parameterize room layout as a set of quads. As such, the proposed architecture is termed as P(oint)Q(uad)-Transformer. Along with the novel quad representation, we propose a tailored physical constraint loss function that discourages object-layout interference. The quantitative and qualitative evaluations on the public benchmark ScanNet show that the proposed PQ-Transformer succeeds to jointly parse 3D objects and layouts, running at a quasi-real-time (8.91 FPS) rate without efficiency-oriented optimization. Moreover, the new physical constraint loss can improve strong baselines, and the F1-score of the room layout is significantly promoted from 37.9% to 57.9%.",2021-09-12T17:31:59Z,"Xiaoxue Chen, Hao Zhao, Guyue Zhou, Ya-Qin Zhang",https://arxiv.org/pdf/2109.05566v2
2108.07249v1,BloomNet: A Robust Transformer based model for Bloom's Learning Outcome Classification,"Bloom taxonomy is a common paradigm for categorizing educational learning objectives into three learning levels: cognitive, affective, and psychomotor. For the optimization of educational programs, it is crucial to design course learning outcomes (CLOs) according to the different cognitive levels of Bloom Taxonomy. Usually, administrators of the institutions manually complete the tedious work of mapping CLOs and examination questions to Bloom taxonomy levels. To address this issue, we propose a transformer-based model named BloomNet that captures linguistic as well semantic information to classify the course learning outcomes (CLOs). We compare BloomNet with a diverse set of basic as well as strong baselines and we observe that our model performs better than all the experimented baselines. Further, we also test the generalization capability of BloomNet by evaluating it on different distributions which our model does not encounter during training and we observe that our model is less susceptible to distribution shift compared to the other considered models. We support our findings by performing extensive result analysis. In ablation study we observe that on explicitly encapsulating the linguistic information along with semantic information improves the model on IID (independent and identically distributed) performance as well as OOD (out-of-distribution) generalization capability.",2021-08-16T17:31:44Z,"Abdul Waheed, Muskan Goyal, Nimisha Mittal, Deepak Gupta, Ashish Khanna, Moolchand Sharma",https://arxiv.org/pdf/2108.07249v1
2602.08216v2,Thermodynamic Isomorphism of Transformers: A Lagrangian Approach to Attention Dynamics,"We propose an effective field-theoretic framework for analyzing Transformer attention through a thermodynamic lens. By constructing a Lagrangian on the information manifold equipped with the Fisher metric, we show that, within the Shannon--Boltzmann entropy framework, the Softmax function arises as a stationary solution minimizing a Helmholtz free energy functional. This establishes a formal correspondence between scaled dot-product attention and canonical ensemble statistics. Extending this mapping to macroscopic observables, we define an effective specific heat associated with fluctuations of the attention energy landscape. In controlled experiments on the modular addition task ($p = 19$--$113$), we observe a robust peak in this fluctuation measure that consistently precedes the onset of generalization. While no asymptotic power-law divergence is detected in this finite-depth regime, the reproducible enhancement of energy variance suggests a critical-like crossover accompanying representational reorganization. Our framework provides a unified statistical-mechanical perspective on attention scaling, training dynamics, and positional encoding, interpreting the phenomena as emergent properties of an effective thermodynamic system rather than isolated heuristics. Although the present results indicate finite-size crossover behavior rather than a strict phase transition, they motivate further investigation into scaling limits of deep architectures through fluctuation-based observables.",2026-02-09T02:42:36Z,Gunn Kim,https://arxiv.org/pdf/2602.08216v2
2402.13572v2,AlgoFormer: An Efficient Transformer Framework with Algorithmic Structures,"Besides natural language processing, transformers exhibit extraordinary performance in solving broader applications, including scientific computing and computer vision. Previous works try to explain this from the expressive power and capability perspectives that standard transformers are capable of performing some algorithms. To empower transformers with algorithmic capabilities and motivated by the recently proposed looped transformer, we design a novel transformer framework, dubbed Algorithm Transformer (abbreviated as AlgoFormer). We provide an insight that efficient transformer architectures can be designed by leveraging prior knowledge of tasks and the underlying structure of potential algorithms. Compared with the standard transformer and vanilla looped transformer, the proposed AlgoFormer can perform efficiently in algorithm representation in some specific tasks. In particular, inspired by the structure of human-designed learning algorithms, our transformer framework consists of a pre-transformer that is responsible for task preprocessing, a looped transformer for iterative optimization algorithms, and a post-transformer for producing the desired results after post-processing. We provide theoretical evidence of the expressive power of the AlgoFormer in solving some challenging problems, mirroring human-designed algorithms. Furthermore, some theoretical and empirical results are presented to show that the designed transformer has the potential to perform algorithm representation and learning. Experimental results demonstrate the empirical superiority of the proposed transformer in that it outperforms the standard transformer and vanilla looped transformer in some specific tasks. An extensive experiment on real language tasks (e.g., neural machine translation of German and English, and text classification) further validates the expressiveness and effectiveness of AlgoFormer.",2024-02-21T07:07:54Z,"Yihang Gao, Chuanyang Zheng, Enze Xie, Han Shi, Tianyang Hu, Yu Li, Michael K. Ng, Zhenguo Li, Zhaoqiang Liu",https://arxiv.org/pdf/2402.13572v2
2405.15310v5,Spectraformer: A Unified Random Feature Framework for Transformer,"Linearization of attention using various kernel approximation and kernel learning techniques has shown promise. Past methods used a subset of combinations of component functions and weight matrices within the random feature paradigm. We identify the need for a systematic comparison of different combinations of weight matrices and component functions for attention learning in Transformer. Hence, we introduce Spectraformer, a unified framework for approximating and learning the kernel function in the attention mechanism of the Transformer. Our empirical results demonstrate, for the first time, that a random feature-based approach can achieve performance comparable to top-performing sparse and low-rank methods on the challenging Long Range Arena benchmark. Thus, we establish a new state-of-the-art for random feature-based efficient Transformers. The framework also produces many variants that offer different advantages in accuracy, training time, and memory consumption. Our code is available at: https://github.com/cruiseresearchgroup/spectraformer .",2024-05-24T07:52:53Z,"Duke Nguyen, Du Yin, Aditya Joshi, Flora Salim",https://arxiv.org/pdf/2405.15310v5
2204.07908v1,MST++: Multi-stage Spectral-wise Transformer for Efficient Spectral Reconstruction,"Existing leading methods for spectral reconstruction (SR) focus on designing deeper or wider convolutional neural networks (CNNs) to learn the end-to-end mapping from the RGB image to its hyperspectral image (HSI). These CNN-based methods achieve impressive restoration performance while showing limitations in capturing the long-range dependencies and self-similarity prior. To cope with this problem, we propose a novel Transformer-based method, Multi-stage Spectral-wise Transformer (MST++), for efficient spectral reconstruction. In particular, we employ Spectral-wise Multi-head Self-attention (S-MSA) that is based on the HSI spatially sparse while spectrally self-similar nature to compose the basic unit, Spectral-wise Attention Block (SAB). Then SABs build up Single-stage Spectral-wise Transformer (SST) that exploits a U-shaped structure to extract multi-resolution contextual information. Finally, our MST++, cascaded by several SSTs, progressively improves the reconstruction quality from coarse to fine. Comprehensive experiments show that our MST++ significantly outperforms other state-of-the-art methods. In the NTIRE 2022 Spectral Reconstruction Challenge, our approach won the First place. Code and pre-trained models are publicly available at https://github.com/caiyuanhao1998/MST-plus-plus.",2022-04-17T02:39:32Z,"Yuanhao Cai, Jing Lin, Zudi Lin, Haoqian Wang, Yulun Zhang, Hanspeter Pfister, Radu Timofte, Luc Van Gool",https://arxiv.org/pdf/2204.07908v1
2106.11895v2,A Latent Transformer for Disentangled Face Editing in Images and Videos,"High quality facial image editing is a challenging problem in the movie post-production industry, requiring a high degree of control and identity preservation. Previous works that attempt to tackle this problem may suffer from the entanglement of facial attributes and the loss of the person's identity. Furthermore, many algorithms are limited to a certain task. To tackle these limitations, we propose to edit facial attributes via the latent space of a StyleGAN generator, by training a dedicated latent transformation network and incorporating explicit disentanglement and identity preservation terms in the loss function. We further introduce a pipeline to generalize our face editing to videos. Our model achieves a disentangled, controllable, and identity-preserving facial attribute editing, even in the challenging case of real (i.e., non-synthetic) images and videos. We conduct extensive experiments on image and video datasets and show that our model outperforms other state-of-the-art methods in visual quality and quantitative evaluation. Source codes are available at https://github.com/InterDigitalInc/latent-transformer.",2021-06-22T16:04:30Z,"Xu Yao, Alasdair Newson, Yann Gousseau, Pierre Hellier",https://arxiv.org/pdf/2106.11895v2
2508.10893v1,STream3R: Scalable Sequential 3D Reconstruction with Causal Transformer,"We present STream3R, a novel approach to 3D reconstruction that reformulates pointmap prediction as a decoder-only Transformer problem. Existing state-of-the-art methods for multi-view reconstruction either depend on expensive global optimization or rely on simplistic memory mechanisms that scale poorly with sequence length. In contrast, STream3R introduces an streaming framework that processes image sequences efficiently using causal attention, inspired by advances in modern language modeling. By learning geometric priors from large-scale 3D datasets, STream3R generalizes well to diverse and challenging scenarios, including dynamic scenes where traditional methods often fail. Extensive experiments show that our method consistently outperforms prior work across both static and dynamic scene benchmarks. Moreover, STream3R is inherently compatible with LLM-style training infrastructure, enabling efficient large-scale pretraining and fine-tuning for various downstream 3D tasks. Our results underscore the potential of causal Transformer models for online 3D perception, paving the way for real-time 3D understanding in streaming environments. More details can be found in our project page: https://nirvanalan.github.io/projects/stream3r.",2025-08-14T17:58:05Z,"Yushi Lan, Yihang Luo, Fangzhou Hong, Shangchen Zhou, Honghua Chen, Zhaoyang Lyu, Shuai Yang, Bo Dai, Chen Change Loy, Xingang Pan",https://arxiv.org/pdf/2508.10893v1
2105.13677v5,ResT: An Efficient Transformer for Visual Recognition,"This paper presents an efficient multi-scale vision Transformer, called ResT, that capably served as a general-purpose backbone for image recognition. Unlike existing Transformer methods, which employ standard Transformer blocks to tackle raw images with a fixed resolution, our ResT have several advantages: (1) A memory-efficient multi-head self-attention is built, which compresses the memory by a simple depth-wise convolution, and projects the interaction across the attention-heads dimension while keeping the diversity ability of multi-heads; (2) Position encoding is constructed as spatial attention, which is more flexible and can tackle with input images of arbitrary size without interpolation or fine-tune; (3) Instead of the straightforward tokenization at the beginning of each stage, we design the patch embedding as a stack of overlapping convolution operation with stride on the 2D-reshaped token map. We comprehensively validate ResT on image classification and downstream tasks. Experimental results show that the proposed ResT can outperform the recently state-of-the-art backbones by a large margin, demonstrating the potential of ResT as strong backbones. The code and models will be made publicly available at https://github.com/wofmanaf/ResT.",2021-05-28T08:53:54Z,"Qinglong Zhang, Yubin Yang",https://arxiv.org/pdf/2105.13677v5
2011.02910v4,Revisiting Stereo Depth Estimation From a Sequence-to-Sequence Perspective with Transformers,"Stereo depth estimation relies on optimal correspondence matching between pixels on epipolar lines in the left and right images to infer depth. In this work, we revisit the problem from a sequence-to-sequence correspondence perspective to replace cost volume construction with dense pixel matching using position information and attention. This approach, named STereo TRansformer (STTR), has several advantages: It 1) relaxes the limitation of a fixed disparity range, 2) identifies occluded regions and provides confidence estimates, and 3) imposes uniqueness constraints during the matching process. We report promising results on both synthetic and real-world datasets and demonstrate that STTR generalizes across different domains, even without fine-tuning.",2020-11-05T15:35:46Z,"Zhaoshuo Li, Xingtong Liu, Nathan Drenkow, Andy Ding, Francis X. Creighton, Russell H. Taylor, Mathias Unberath",https://arxiv.org/pdf/2011.02910v4
